Season,Episode,Game,Round,Question,Question Text,Contestant ID,Contestant Answer,Panelist 1 Answer,Panelist 1 Matched,Panelist 2 Answer,Panelist 2 Matched,Panelist 3 Answer,Panelist 3 Matched,Panelist 4 Answer,Panelist 4 Matched,Panelist 5 Answer,Panelist 5 Matched,Panelist 6 Answer,Panelist 6 Matched,Alternate Panelist,Alternate Panelist Position,Notes
74,255,321,2,B,Melanie got blank in the Astrodome.,318,mugged,ball gamed,no,made love to,no,dizzy,no,bagged,no,with child,no,turfed,no,,,
74,255,322,1,B,"Soon after King Kong was drafted into the army, he was court-martialed for blanking an officer.",320,eating,saluting,no,capturing,no,kissing,no,eating,yes,swatting,no,carrying off,no,,,
74,256,322,1,A,"Joe said to Mike, ""What's green and pink and wobbles like a huge blob of Jell-O?"" and Mike said, ""I don't know,"" and Joe said, ""I don't know either, but it's oozing all over your blank.""",319,head,shirt,no,heart,no,suit,no,pants,no,lap,no,body,no,,,
74,256,322,2,B,Everyone at Disneyland was shocked when a giant buzzard blanked Mary Poppins.,320,messed on,doo dood,yes,grabbed,no,picked up,no,,,bombed,yes,picked up,no,,,
74,256,322,2,A,"Walter said, ""I just saw a science fiction movie that takes place in Washington, D.C. All the politicians in it are blank.""",319,not crooked,doo doo,no,crooked,no,tape,no,honest,yes,honest,yes,nude with antennas,no,,,
74,256,323,1,B,"Before musical instruments were brought to the North Pole, Nanook played boogie woogie on his blank.",321,igloo,snowshoe,no,igloo,yes,icicles,no,igloo,yes,igloo,yes,sled,no,,,
74,257,323,1,A,"The cannibal said, ""I just had a terrific Italian dinner. I ate blank cacciatore.""",320,missionary,joe,no,missionary,yes,godfather,no,man,no,godfather,no,grandmother,no,,,
74,257,323,2,B,The blacksmith believes in being prepared. He always keeps a blank in his pants.,321,hammer,shoe,no,,,horseshoe,no,,,,,horseshoe,no,,,
74,257,323,2,A,"The old sailor said to the new sailor, ""Since this is your first time at sea, I'll give you some advice. Never blank into the wind.""",320,tinkle,spit,no,,,tinkle,yes,sail,no,throw garbage,no,throw up,no,,,
74,257,324,1,A,"At the Match Game Christmas party, everybody kissed Brett when Brett put blank over her head.",322,mistletoe,mistletoe,yes,lampshade,no,mistletoe,yes,richard dawson,no,mistletoe,yes,mistletoe,yes,,,
74,257,324,1,B,"Roy Rogers said, ""This new dog food smells like a dead horse,"" and Dale Evans said, ""That's not dog food you're smelling. That's your blank.""",321,dinner,breath,no,horse,no,breath,no,horse,no,dinner,yes,trigger,no,,,
74,257,324,2,A,The Martian was a big hit at the party because he used his blank as a corkscrew.,322,antenna,,,antenna,yes,,,antenna,yes,,,,,,,
74,258,324,2,B,"Tarzan's getting really weird. In his new movie, he swings on a vine, he beats his chest, and he goes ""Ohhhh!"" then makes a funny face and blanks his loin cloth.",321,throws away,rips,no,,,,,,,,,,,,,
74,258,325,1,B,"Margie said, ""My boyfriend makes me feel like a real woman. On the other hand, my husband makes me feel like a blank.""",323,man,dummy,no,drag,no,old maid,no,maid,no,corpse,no,man,yes,,,
74,258,325,1,A,"The passenger said to the captain of the Poseidon, ""I know it's not your fault that the ship turned upside down, but it sure is hard to play blank.""",322,shuffleboard,cards,no,ping pong,no,pool,no,jacks,no,cards,no,checkers,no,,,
74,258,325,2,B,"Here's a TV Guide listing: Tuesday night, CBS, Kojak. A Japanese gardener plants a lawn on Kojak's scalp. Kojak loves the way it looks, but hates it when the gardener blanks his head.",323,mows,rakes,no,shaves,yes,mows,yes,mows,yes,fertilizes,no,,,,,
74,258,325,2,A,"Bruno said to the Godfather, ""Why do you think that car that nearly hit you was no accident?"" and the Godfather said, ""Because you don't normally get hit by a car in your own blank.""",322,driveway,bed,no,yard,no,driveway,yes,house,no,,,,,,,
74,259,326,1,A,"When Ellen went streaking through Murray's delicatessen, she came out with blank all over her.",324,salami,cream cheese,no,sauerkraut,no,chicken liver,no,hot pastrami,no,chicken fat,no,cream cheese,no,,,
74,259,326,1,B,"Dr. Quacklini told Jack, ""You take two garlic cloves and put them in your nose."" And he did, and in no time at all, his blank went away.",323,cold,face,no,breath,no,cold,yes,cold,yes,blocked sinus,no,cold and sniffles,yes,,,
74,259,326,2,B,"Fat Fannie went to the costume party dressed as Moby Dick, the great white whale. Some fat guy dressed as a sailor tried to blank her.",324,hook,harpoon,no,take her out to sea,no,harpoon,no,harpoon,no,harpoon,no,,,,,
74,260,327,1,B,"Gloria said, ""My husband is very peculiar. For our ivory wedding anniversary, he gave me a blank.""",325,wig,elephant,no,tusk,no,bar of soap,no,elephant's tusk,no,elephant,no,elephant,no,,,
74,260,327,1,A,"Charles Nelson Reilly said, ""When I'm on Broadway, I wear a $500 toupee made out of hair, but on Match Game, I wear a $2 toupee made out of blank.""",323,straw,steel wool,no,sheep's wool,no,horse's tail,no,dynel,no,brillo pads,no,brett's toupee,no,,,
74,260,327,2,B,"As they led Scarface to the electric chair, the governor asked him if he had a last request, and Scarface said, ""Yeah, governor. Blank me.""",325,spare,kiss,no,kiss,no,free,yes,kiss,no,reprieve,yes,kiss,no,,,
74,260,327,2,A,"The surgeon said to his nurse, ""I seem to have misplaced my watch. Phone that patient I operated on this morning, and ask her if her blank is ticking.""",323,tummy,tummy,yes,tum-tum,yes,stomach,yes,,,,,,,,,
74,260,328,1,B,"The reporter said to the 139-year-old man, ""Tell me, old man, what is the secret of your long life?"" and the wise old man said, ""Simple, young fella. I blank ten times every day.""",326,have sex,drink,no,make whoopee,yes,make love,yes,have sex,yes,stand up,no,romance a woman,yes,,,
74,261,328,1,A,"Marty said, ""I visited a strange tropical island on my vacation. At weddings, instead of throwing rice, they throw blank.""",323,coconuts,coconuts,yes,coconuts,yes,coconuts,yes,coconuts,yes,coconuts,yes,bananas,no,,,
74,261,328,2,B,"Hey, did you hear what happened to Snoopy? While showing Charlie Brown how fast he could type, Snoopy accidentally rolled his blank into the typewriter.",326,nose,tail,no,,,,,,,tail,no,,,,,
74,261,329,1,B,20 million television viewers were shocked to see the Ty-D-Bol man blanking from the side of his boat.,327,tinkling,fishing,no,tinkling,yes,tinkling,yes,throwing up,no,clinging,no,throwing up,no,,,
74,261,329,1,A,"Dr. Frankenstein said, ""I've named my new female monster Judy Jukebox. Put a dime into her navel, and stereophonic music comes out of her blank.""",323,mouth,belly button,no,ears,no,boobs,no,mouth,yes,boobs,no,mouth,yes,,,
74,261,329,2,B,"Grandma said, ""Grandpa's been sneaking out at night and dating chorus girls, but I just put a stop to that. I hid his blank.""",327,keys,glasses,no,,,,,dentures,no,false teeth,no,wheelchair,no,,,
74,262,329,2,A,"The little old woman who lived in a shoe had so many children she didn't know what to do. So to get money for food, she sold her blank to the devil.",323,soul,soul,yes,,,,,,,,,,,,,
74,262,330,1,A,"Irving said, ""That guy who wrote 'Life is just a bowl of cherries' never worked in a delicatessen. What I always sing is, 'Life is just a bowl of blank.'""",328,pickles,bagels,no,borscht,no,bagels,no,rude people,no,borscht,no,borscht,no,,,
74,262,330,1,B,"After he ate Euell Gibbons, the cannibal said, ""Mmm, Gibbons taste just like blank.""",323,hickory nuts,raisin bran,no,hickory nuts,yes,hickory nuts,yes,wild hickory nuts,yes,wild hickory nuts,yes,spare ribs,no,,,
74,262,330,2,B,"Diane said to the psychiatrist, ""Dr. Hastings, I really don't think you should blank while I'm telling you my problems.""",328,sleep,cry,no,nod off,yes,snooze,yes,sleep,yes,sleep,yes,sleep,yes,,,
74,262,330,2,A,"The loan shark said to the exotic dancer, ""I can give you the loan, but I'll have to hold one of your blanks as collateral.""",323,pasties,tops,no,,,,,,,,,fans,no,,,
74,263,331,1,B,"Poor Noah. When the ark tipped over, he rescued all the animals, and then he tried to give mouth-to-mouth resuscitation to a blank.",329,elephant,ark,no,whole group,no,giraffe,no,hippo,no,hippo,no,rhino,no,,,
74,263,331,1,A,"The soda jerk said, ""We call this concoction a Godfather sundae. It's twelve scoops of ice cream with blank on top.""",328,strawberry jam,blood,no,blood,no,blood,no,bullets,no,bullets,no,spaghetti sauce,no,,,
74,263,331,2,B,"Cleopatra said to Mark Antony, ""I knew we were meant for each other the moment your blank touched mine.""",329,boobs,bod,no,barge,no,barge,no,lips,no,lips,no,asp,no,,,
74,263,331,2,A,"As they were driving around in the sports car, Linda said, ""Fred? Fred? That's not the gearshift you're holding. You're trying to shift my blank.""",328,knee,knee,yes,knee,yes,knee,yes,knee,yes,knee,yes,knee,yes,,,
74,263,332,1,A,"Marge said, ""My husband is so cheap, on our iron wedding anniversary, all he gave me was a blank.""",330,ironing board,his wash,no,iron,no,nail,no,iron,no,iron,no,anvil,no,,,
74,264,332,1,B,"At the picnic, the absent-minded cop ate his gun and shoved a blank into his holster.",328,frankfurter,hot dog,yes,coke,no,sandwich,no,banana,no,sandwich,no,candy bar,no,,,
74,264,332,2,B,"Dumb Dora said, ""To save money, I fed my husband nothing but chicken feed for a whole year. He's perfectly normal, except sometimes he blanks around the house.""",330,lays an egg,clucks,no,clucks,no,clucks,no,lays eggs,yes,crows,no,pecks,no,,,
74,264,332,2,A,"Tony the hubcap thief has style. He saunters up to a car, slips his hands into his pockets, and pries off the hubcap with his blank.",328,gun,,,fingers,no,toe,no,toes,no,teeth,no,toes,no,,,
74,264,332,tie1,A,"Dumb Dora was so dumb, she tried to color her hair with blank.",330,crayons,crayons,yes,crayons,yes,crayons,yes,crayons,yes,ketchup,no,shoe polish,no,,,
74,264,332,tie1,B,"Lloyd Bridges said, ""Now that my series Sea Hunt is over, I can admit it: I'm afraid of blank.""",328,water,fish,no,water,yes,water,yes,water,yes,water,yes,sharks,no,,,
74,264,332,tie2,A,"The Swiss yodeling instructor said, ""The most important thing in yodeling is, don't blank your tongue.""",330,swallow,swallow,yes,bite,no,bite,no,bite,no,swallow,yes,hold,no,,,
74,264,332,tie2,B,"Tonto said, ""Lone Ranger get plenty drunk at party. Him take blank off.""",328,mask,day,no,clothes,no,mask,yes,mask,yes,mask,yes,mask,yes,,,
74,265,333,1,A,"Brett said, ""Power failures are terrific. Me and two sailors just spent five wonderful hours in the blank.""",331,elevator,kitchen,no,watt box,no,dark,no,bar,no,dark,no,elevator,yes,,,
74,265,333,1,B,"Gloria said, ""My boyfriend is such a practical joker. Last night, he put a blank in my waterbed.""",328,fish,ice cube,no,hole,no,goldfish,yes,fish,yes,hole,no,fish,yes,,,
74,265,333,2,A,"Before Tarzan left the jungle forever, Jane asked for something to remember him by. So Tarzan had his blank bronzed.",331,loin cloth,loin cloth,yes,loin cloth,yes,loin cloth,yes,vine,no,loin cloth,yes,,,,,
74,265,333,2,B,"When the two contortionists accidentally tied themselves together during their act, they needed blank to get them apart.",328,grease,crow bar,no,help,no,,,,,,,,,,,
74,266,334,1,A,"When the teacher caught little Johnny streaking, she sent him home with a note glued to his blank.",332,bottom,behind,yes,body,no,forehead,no,bum,yes,rear end,yes,bottom,yes,,,
74,266,334,1,B,"Doug said, ""I just took a trip on an airline that had really first-class service. After you eat, the stewardess blanks you.""",331,burps,smiles at,no,massages,no,bathes,no,kisses,no,loves,no,burps,yes,,,
74,266,334,2,A,"Tommy's mother screamed, ""Tommy! How many times do I have to tell you, you don't wash the cat in the blank!""",332,bathtub,,,washing machine,no,dishwasher,no,,,,,,,,,
74,266,334,2,B,"Burt said, ""Those ants at the picnic were the strongest ants I've ever seen. While I was eating my lunch, those ants carried off my blank.""",331,wife,wine,no,children,no,camera,no,hamper,no,wife,yes,,,,,
74,266,335,1,A,"The Frankenstein monster said to Brett, ""If you were the only girl in the world and I were the only boy, I think I would blank.""",333,die,marry you,no,leave,no,die,yes,give up,no,kill myself,yes,die,yes,,,
74,267,335,1,B,"Secret Agent Maxwell Smart said, ""Chief, it's bad enough making a man in my position spy on a farmer, but do I have to dress up as a blank?""",332,cow,carrot,no,scarecrow,no,scarecrow,no,cowhand,no,bull,yes,farmer's daughter,no,,,
74,267,335,2,A,The Boy Scouts were shocked to see Smokey the Bear blanking behind a tree.,333,tinkling,smoking,no,smoking grass,no,,,,yes,,,,,,,
74,267,335,2,B,Euell Gibbons has eaten so much natural food that he now goes to a tree surgeon to have his blank trimmed.,332,hair,branches,no,hair,yes,hair,yes,hair,yes,,,hair,yes,,,
74,267,336,1,B,You can always tell when Olive Oyl's been out with Popeye. She comes home with spinach on her blank.,334,teeth,lips,no,chest,no,collar,no,face,no,dress,no,mouth,no,,,
74,267,336,1,A,"Alejandro said, ""The Flying Nun stopped flying after she broke the blank.""",332,habit,hat,yes,habit,yes,habit,yes,sound barrier,no,faith,no,veil,no,,,
74,267,336,2,A,Count Dracula quit the hockey team because they wouldn't let him blank the puck.,334,suck,lost,no,eat,no,bite,yes,suck,yes,suck,yes,suck,yes,,,
74,268,336,2,B,Did you hear about the nearsighted whale? He fell in love with a blank.,332,ship,,,,,,,porpoise,no,submarine,no,hippo,no,,,
74,268,337,1,B,"Cowboy said, ""That gunslinger took a shot at me, but I was lucky. The bullet went right into my blank.""",335,holster,buckle,no,bow legs,no,horse,no,saddle bag,no,behind,no,hat,no,,,
74,268,337,1,A,"Superman said, ""I've been a big fan of Charles Nelson Reilly ever since I found out he secretly blanks like me.""",334,dresses,flies,no,flies,no,flies,no,flies,no,flies,no,dresses,yes,,,
74,268,337,2,B,"Ken said, ""I took that El Cheapo cruise ship to Europe, and you know what? I had to blank all the way.""",335,bail,swim,no,row,no,row,no,stand,no,paddle,no,row,no,,,
74,269,338,1,A,"After spending five years together on the island, Robinson Crusoe said to Friday, ""You know, you're beginning to look a lot like blank.""",336,coconut,my wife,no,raquel welch,no,raquel welch,no,eve,no,brett,no,my wife,no,,,
74,269,338,1,B,"Cinderella's stepsister was so ugly, when Prince Charming handed her the glass slipper, she couldn't fit it on her foot, but it fit perfectly on her blank.",334,nose,nose,yes,nose,yes,nose,yes,nose,yes,nose,yes,nose,yes,,,
74,269,338,2,A,"The Great Reynaldo said, ""Any hypnotist can make a person go 'quack quack', but when I, the Great Reynaldo, say, 'You are a duck,' you begin to blank.""",336,bark,quack quack,no,swim,no,,,,,,,,,,,
74,269,339,1,B,"When Sally kissed the magic frog, she became blank.",337,a frog herself,pregnant,no,fertile,no,with child,no,pregnant,no,with child,no,pg,no,,,
74,270,339,1,A,"Dumb Dora is so dumb, when her husband was in prison, she tried to smuggle him a hacksaw in a blank.",334,cake,toothpick,no,envelope,no,ice cream cake,yes,pie,no,sandwich,no,cake,yes,,,
74,270,339,2,B,"Leonard said, ""My wife treats me like a dog. She even blanks me.""",337,kicks,housebreaks,no,paper trains,no,walks,no,strokes,no,walks,no,pets,no,,,
74,270,340,1,A,"Margo said, ""I don't think Dr. Smith is a real doctor. A real doctor doesn't examine you in the blank.""",338,dark,darkness,yes,hotel room,no,motel,no,waiting room,no,nude,no,sauna,no,,,
74,270,340,1,B,"The lady bullfighter lost her cape, so she shook her blank at the bull.",334,dress,skirt,no,bosoms,no,boobs,no,tassels,no,bosoms,no,bra,no,,,
74,271,340,2,B,"Snow White was really a rotten person, if you want to know the truth. She blackmailed the Seven Dwarves with a Polaroid picture of them blanking in the woods.",338,tinkling,,,streaking,no,kissing,no,working,no,streaking,no,smoking,no,,,
74,271,340,2,A,Mildred got on Let's Make a Deal by shaking her blank in Monty Hall's face.,334,tushy,boobies,no,other end,yes,bosom,no,hand,no,bosom,no,maracas,no,,,
74,271,340,tie1,A,"Before the royal king got into the royal pool, he dipped his royal blank in it.",338,toe,toe,yes,bum,no,toe,yes,toe,yes,toe,yes,toe,yes,,,
74,271,340,tie1,B,"Tom said to Dumb Dora, ""Why are you shaking that live chicken?"" and Dora said, ""I'm trying to make it lay blank eggs.""",334,golden,scrambled,no,scrambled,no,scrambled,no,scrambled,no,scrambled,no,scrambled,no,,,
74,271,341,1,A,"Allen Ludden said, ""My wife Betty White doesn't know her own strength. The last time she gave me a great big hug, she broke my blank.""",336,glasses,glasses,yes,ribs,no,ribs,no,ribs,no,ribs,no,glasses,yes,,,
74,272,341,1,B,They just put a vicious watchdog in front of the White House. He's trained to keep blank out.,338,democrats,reporters,no,democrats,yes,democrats,yes,tapes,no,,,the press,no,,,
74,272,341,2,B,"Tough Tony said, ""My gang is so tough, we even steal the blank from moving cars.""",336,hubcaps,,,hubcaps,yes,hubcaps,yes,wheels,no,hubcaps,yes,,,,,
74,272,341,2,A,"Dumb Dora is so dumb that to save time in the morning, she blanks before she goes to sleep.",338,dresses,eats breakfast,no,,,,,dresses,yes,eats,no,eats breakfast,no,,,
74,272,342,1,B,"Walter fell asleep and dreamed he was a giant ice cream sundae. When he woke up, his wife was covering him with blank.",339,whipped cream,fudge sauce,no,nuts,no,whipped cream,yes,cold feet,no,hot fudge,no,whipped cream,yes,,,
74,272,342,1,A,"Dale Evans said, ""This Thanksgiving, we're not going to have a turkey. I'm going to stuff my blank instead.""",336,horse,horse,yes,goose,no,horse,yes,horse,yes,horse trigger,yes,goose,no,,,
74,272,342,2,A,"George said, ""Boy, is Ted's wife strange looking. When I first saw her, I thought she was his blank.""",339,brother,dog,no,boyfriend,no,,,brother,yes,brother,yes,,,,,
74,273,342,2,B,Linda lost her blank while bouncing on the trampoline.,336,virtue,,,innocence,yes,,,,,,,bra,no,,,
74,273,343,1,A,"Brett said, ""I have an annoucement to make during the next commercial. I'm going to blank the man on the buzzer.""",340,kiss,kill,no,shoot,no,kill,no,kiss,yes,kill,no,kiss,yes,,,
74,273,343,1,B,"The man from Mars said, ""I guess I do look a little strange to you. I have three toes on my right foot, eight toes on my left foot, and on my other foot, I have a blank.""",336,finger,hoof,no,mouth,no,ear,no,finger,yes,roller skate,no,corn,no,,,
74,273,343,2,A,"The lawyer said to the assembled relatives, ""I'm afraid this will has an unusual requirement. Before I can read it, you all must be blank.""",340,drunk,naked,no,naked,no,blindfolded,no,,,nude,no,,,,,
74,273,343,2,B,"Greta said, ""My husband has been a sailor too long. He won't even get into a bathtub without a blank.""",336,ship,life preserver,no,lifesaver,no,compass,no,,,mae west,no,lifesaver,no,,,
74,274,344,1,A,"The doctor shouted up to the Jolly Green Giant, ""Hey, Green Giant, the reason you're having so much trouble hearing is because you've got a blank stuck in your ear!""",341,ear of corn,corn cob,yes,pea,no,corn,yes,carrot,no,pea,no,pea,no,,,
74,274,344,1,B,"Grandpa Jones said, ""My wife is 125 years old, but she can blank like a woman of 80.""",340,make love,make love,yes,rock,no,make love,yes,kiss,no,move,no,dance,no,,,
74,274,344,2,A,"Donna said, ""When my husband dreams, he talks in his sleep. Last night, I think he dreamed he was a dentist, because he kept telling me to blank.""",341,open wide,,,open my mouth,yes,,,open my mouth,yes,open my mouth,yes,open my mouth,yes,,,
74,274,344,2,B,"The Godfather said, ""Vito, remember my motto. A rolling meatball gathers no blank.""",340,sauce,,,moss,no,,,sauce,yes,sauce,yes,sauce,yes,,,
74,275,345,1,A,"The Great Reynaldo said, ""I'm leaving this crummy circus. They're so cheap, they make me share a bed with the blank.""",342,lions,bearded lady,no,elephant,no,elephant,no,lion,yes,bearded lady,no,snake,no,,,
74,275,345,1,B,"When Smilin' Jack drove his motorcycle clear through the barn, he came out with blank stuck in his teeth.",341,straw,hay,yes,straw,yes,hay,yes,hay,yes,straw,yes,hay,yes,,,
74,275,345,2,A,"Robinson Crusoe put this want ad in the paper: ""Wanted: attractive outdoor-type person to share desert island. Must be good blank.""",342,company,cook,no,lover,no,,,,,cook,no,cook,no,,,
74,275,346,1,A,"Tom said, ""I've got good news. I wallpapered the entire bedroom in less than an hour,"" and Selma said, ""I've got bad news. That big bump over there is where you wallpapered over our blank.""",343,window,bed,no,baby,no,john,no,bed,no,bed,no,dog,no,,,
74,276,346,1,B,"Chiquita the flamenco dancer said, ""I forgot my castanets, so at tonight's performance, I'll be banging my blanks together.""",341,boobs,bananas,no,knockers,yes,boobs,yes,false teeth,no,heels,no,earrings,no,,,
74,276,346,2,A,"The old prospector said, ""Last week some strange young fella named Kung Fu walked into my camp and blanked my burro.""",343,kicked,judo-chopped,no,karated,no,karated,no,blessed,no,stole,no,,,,,
74,276,347,1,A,"Luigi the Italian field goal kicker lost his football, so he kicked his blank over the goal posts.",344,shoe,pizza,no,helmet,no,meatball,no,meatball,no,meatball,no,meatball,no,,,
74,277,347,1,B,"Remember that old song ""Singing in the Rain?"" Well, there's a new song out called ""Blanking in the Rain.""",341,streaking,streaking,yes,tinkling,no,streaking,yes,streaking,yes,streaking,yes,streaking,yes,,,
74,277,347,2,A,"Euell Gibbons' wife said, 'I think Euell has eaten too much natural food. The first day of spring, his blank turned green.""",344,hair,nose,no,mouth,no,,,hairs,yes,hair,yes,body,no,,,
74,277,348,1,B,"Freddie said, ""You should've seen me on The Original Amateur Hour. The switchboard lit up when I blanked Ted Mack.""",345,kissed,kissed,yes,smacked,no,kissed,yes,set fire to,no,sat on,no,played,no,,,
74,277,348,1,A,"Charles Nelson Reilly said, ""It's terrible being up here on this upper tier. Every time Brett matches a contestant, she puts a blank on my leg.""",341,hand,hickey,no,notch,no,hickey,no,hand,yes,hand,yes,hand,yes,,,
74,278,348,2,B,Superman lost his blank in a telephone booth.,345,suit,,,glasses,no,,,s,no,virtue,no,clothes,yes,,,
74,278,348,2,A,"Stephanie said, ""I'm not dating Farmer John anymore until he gets a car. I'm sick and tired of going to drive-in movies on a blank.""",341,horse,cow,no,jackass,no,cow,no,,,,,,,,,
74,278,348,tie1,A,"The Texan said to his butler, ""I've invited two hundred people for cocktails. You'd better mix martinis in the blank.""",345,bathtub,swimming pool,no,swimming pool,no,oil well,no,pool,no,pool,no,pool,no,,,
74,278,348,tie1,B,"The nurse said to the doctor, ""I know it's none of my business, but I really don't think it's right to give your girlfriend a free blank for her birthday.""",341,examination,operation,no,shot,no,physical,yes,operation,no,examination,yes,facelift,no,,,
74,279,349,1,B,"In Africa, they have an unusual firing squad. Instead of ten soldiers with rifles, they have ten cannibals with blanks.",346,elephants,soup spoons,no,knives and forks,no,forks,no,knives and forks,no,napkins,no,knives and forks,no,,,
74,279,349,1,A,"The psychiatrist said, ""Mrs. Golden, let me explain. My last patient thought he was a dog. That's why there's a blank on the couch.""",341,puddle,little yellow spot,yes,puddle,yes,bone,no,spot,no,stain,yes,spot,no,,,
74,279,349,2,A,"King Kong is so big, he uses a helicopter as a blank.",346,beanie cap,truss,no,bike,no,hair dryer,no,egg beater,no,electric razor,no,fan,no,,,
74,280,350,1,B,"While visiting Rome, Dumb Dora didn't have a coin, so she threw her blank into the fountain.",347,husband,shorts,no,self,no,credit cards,no,teeth,no,dress,no,purse,no,,,
74,280,350,1,A,"Brett said, ""Will Rogers never met a man he didn’t like. But Will Rogers never met blank.""",341,jack klugman,jack klugman,yes,jack klugman,yes,my husband,yes,the emmy-winning half of the odd couple tv show,yes,j. klugman,yes,jack klugman,yes,,,
74,280,350,2,B,"Susan and Richard were so skinny, they used to blank in the chimney.",347,dance,sleep,no,smoke,no,,,,,,,dance,yes,,,
74,281,351,1,A,"Nellie said, ""My husband the baseball player thinks love is just like spring training. When we went on our honeymoon, he brought along a blank.""",348,glove,third baseman,no,bat,no,ball,no,glove,yes,teammate,no,catcher's mitt,yes,,,
74,281,351,1,B,"I have a letter for you from the newspaper: ""Dear Miss Beauty Hints, I followed your advice and soaked myself for an hour in lemon juice. Not only did my complexion get worse, but now I've got puckered blanks.""",341,boobs,boobs,yes,lips,no,lips,no,toes,no,cheeks,no,cheeks,no,,,
74,281,351,2,A,Bessie got blank at the OK Corral.,348,kissed,loaded,no,lassoed,no,branded,no,,,preggie,no,,,,,
74,281,351,2,B,"The ringmaster said, ""Ladies and gentlemen! Any magician can pull a rabbit out of his hat, but only the Great Barzini, the world-famous circus magician, can pull a blank out of his shorts.""",341,elephant,,,bird,no,dove,no,carrot,no,carrot,no,friend,no,,,
74,282,352,1,B,"On an old tombstone just outside of Dodge City is inscribed the following epitaph, ""Here lies Luscious Lil, the Old West's first exotic dancer. She died with her blanks on.""",349,dangles,tassels,yes,boobs,no,boobs,no,pasties,yes,pasties,yes,veils,no,,,
74,282,352,1,A,The only time Charles Nelson Reilly wears socks is when Charles Nelson Reilly blanks.,348,makes love,bathes,no,sleeps,no,sleeps,no,sleeps,no,makes films in tijuana,no,sings opera,no,,,
74,282,352,2,A,"When Rosita's new boyfriend tasted her hot tamales, flames shot out of his blank.",349,ears,,,mouth,no,mouth,no,,,,,tongue,no,,,
