Season,Episode,Game,Round,Question,Question Text,Contestant ID,Contestant Answer,Panelist 1 Answer,Panelist 1 Matched,Panelist 2 Answer,Panelist 2 Matched,Panelist 3 Answer,Panelist 3 Matched,Panelist 4 Answer,Panelist 4 Matched,Panelist 5 Answer,Panelist 5 Matched,Panelist 6 Answer,Panelist 6 Matched,Alternate Panelist,Alternate Panelist Position,Notes
74,174,227,2,B,"While Pinocchio was sleeping, his girlfriend blanked his nose.",226,cut off,sawed,yes,snipped,yes,trimmed,no,shortened,no,painted,no,sawed,yes,,,
74,175,228,1,A,"Here's a letter: ""Dear Match Game '74, I love it when your panelists give dumb answers, and I think the dumbest answers come from blank.""",228,brett,brett,yes,brett,yes,brett,yes,brett,yes,brett,yes,pat,no,,,
74,175,228,1,B,"Joe said to Ted, ""What's twelve feet long, weighs three tons, and looks like a snail?"" and Ted said, ""I don't know,"" and Joe said, ""I don't know either, but it's blanking your Volkswagen.""",226,crushing,eating,no,blocking,no,dragging,no,eating,no,loving,no,kissing,no,,,
74,175,228,2,A,"When old Charlie celebrated his 97th birthday, they gave him a cake in the shape of a blank.",228,lady,,,,,,,,,,,boob,no,,,
74,175,228,2,B,"As Long John Silver was addressing the crew, his parrot blanked into his ear.",226,whispered,whispered,yes,bit,no,shouted,no,,,,,,,,,
74,176,229,1,B,"Half Nelson Reilly is the world's strangest wrestler. First he pins you to the mat, then he blanks your toes.",229,counts,bites,no,kisses,no,bites,no,kisses,no,kisses,no,bites,no,,,
74,176,229,1,A,King Midas took the dutchess down to the royal gymnasium and showed her his solid gold blank.,228,belly button,barbell,no,athletic equipment,no,bar,no,barbell,no,barbell,no,basketball,no,,,
74,176,229,2,B,"Dennis said to the waitress, ""This coffee is so strong it's dissolving my blank.""",229,spoon,spoon,yes,teeth,no,tongue,no,tongue,no,spoon,yes,teeth,no,,,
74,176,229,2,A,"Brenda said to Ted, ""You've got some nerve telling my mother her perfume smells like the inside of a blank.""",228,garbage can,gymnasium,no,pigpen,no,house of ill repute,no,skunk's mouth,no,garbage pail,yes,men's gym,no,,,
74,176,230,1,B,"A man from the bakery phoned. He said, ""Now don't be upset, Mrs. Levy, but your husband fell into the dough machine. Right now, he's a giant blank.""",230,donut,bagel,no,donut,yes,pretzel,no,bun,no,pretzel,no,bagel,no,,,
74,177,230,1,A,"What to do while you're waiting in line for gas: 1, turn off your engine, 2, loosen your tie, 3, take out your blank.",229,wallet,knitting,no,newspaper,no,lunch,no,lunch,no,cigar,no,compact,no,,,
74,177,230,2,A,"When the elephant joined the Navy, he learned how to blank with his trunk.",230,salute,signal,no,,,swab decks,no,salute,yes,swim,no,swab,no,,,
74,177,230,2,B,The Jolly Green Giant woke up and found two little people blanking on his nose.,229,sitting,dancing,no,sitting,yes,kissing,no,dancing,no,swinging,no,camping,no,,,
74,177,231,1,B,"When the Godfather couldn't get any gasoline, he pumped his tank full of blank.",231,blood,moonshine,no,lead,no,vino,no,olive oil,no,holes,no,booze,no,,,
74,177,231,1,A,"Little Red Riding Hood said, ""I got away from the Big Bad Wolf, but Euell Gibbons ate my blank.""",230,basket,grandmother,no,basket,yes,dandelion cookies,no,basket,yes,goodies,no,goodies,no,,,
74,177,231,2,B,Dumb Dora thought Beethoven's Fifth was a blank.,231,bottle of booze,bottle,yes,department store,no,drink,no,plea,no,wife,no,bottle of booze,yes,,,
74,178,231,2,A,"During the big inspection, the Colonel blanked on the General's shoes.",230,tinkled,stepped,no,,,stepped,no,,,trod,no,stepped,no,,,
74,178,231,tie1,B,"The ambassador of the tiny little republic of Wizdonia said, ""Our country has everything except blank.""",231,women,money,no,men,no,fuel,no,immigrants,no,bathrooms,no,land,no,,,
74,178,231,tie1,A,"The Tin Man's pants kept falling down, so finally he blanked them on.",230,nailed,nailed,yes,nailed,yes,soldered,no,screwed,no,welded,no,soldered,no,,,
74,178,232,1,B,"When Captain Hook became a waiter, he went to a silversmith and had his hook changed into a blank.",232,knife,tray,no,tray,no,tray,no,tray,no,tray,no,tray,no,,,
74,178,232,1,A,"Betty White said, ""Every time I go streaking, Allen Ludden makes me wear his blank.""",230,shorts,shoes,no,loafers,no,watch,no,glasses,no,smile,no,glasses,no,,,
74,178,232,2,A,Linda gave her blank to every man in the office.,232,love,phone number,no,phone number,no,phone number,no,all,yes,favors,yes,number,no,,,
74,178,232,2,B,"When King Kong makes a king-size martini, he doesn't put a little olive in it, he puts a blank in it.",230,coconut,coconut,yes,grapefruit,no,watermelon,no,watermelon,no,pumpkin,no,banana,no,,,
74,179,233,1,A,Little Orphan Annie cried and cried because her dog Sandy had eaten her blank.,233,daddy warbucks,eyeballs,no,only dress,no,only dress,no,dress,no,daddy warbucks,yes,candy,no,,,
74,179,233,1,B,"Norma said to her husband, ""I don't mind if your brother stays with us, but does he have to play handball in the blank?""",232,bedroom,bathroom,no,backyard,no,john,no,potty,no,nude,no,bathroom,no,,,
74,179,233,2,A,"Fu Manchu said, ""Once a year on my honorable birthday, honorable geisha girl blanks my honorable feet.""",233,kiss,kisses,yes,washes,no,washes,no,kisses,yes,,,washes,no,,,
74,179,233,2,B,"Before the operation, Dr. Newman couldn't find his surgical mask, so he wore a blank over his head.",232,sheet,bag,no,sack or bag,no,paper bag,no,sock,no,bra,no,sack,no,,,
74,180,234,1,A,"Every morning, the old soldier makes his blank stand at attention.",234,son,orderly,no,sword,no,faithful dog,no,wife,no,wife,no,wife,no,,,
74,180,234,1,B,"When Bruno the wrecker lost his big steel ball, he knocked down the building with his blank.",233,coconut,salami,no,truck,no,lunch pail,no,head,yes,head,yes,crane,no,,,
74,180,234,2,A,"Gloria is an unusual tap dancer. Instead of putting taps on her shoes, she puts them on her blank.",234,hands,knees,no,cheeks,no,bust,no,bare feet,no,feet,no,,,,,
74,180,235,1,B,"J. Harrison Farquhar's house is so big, you can actually blank in the living room.",235,dance,play tennis,no,skate,no,bowl,no,bowl,no,bowl,no,play football,no,,,
74,180,235,1,A,"While making a long-distance call, Stephanie lost her blank in the telephone booth.",233,girdle,contacts,no,youth,no,mind,no,self respect,no,virtue,no,money,no,,,
74,181,235,2,B,"Warning: in New York City, blanking may be hazardous to your health.",235,streaking,breathing,no,walking,no,breathing,no,breathing,no,walking,no,streaking,yes,,,
74,181,235,2,A,"Dumb Dora couldn't find a strainer, so she poured the tea through her blank.",233,bra,bra,yes,pantyhose,no,bra,yes,hankie,no,bra,yes,bra,yes,,,
74,181,236,1,B,The passengers on the airplane became upset when they saw the copilot giving the pilot a blank.,236,alcoholic drink,goose,no,kiss,no,broad,no,flying lesson,no,massage,no,drink,yes,,,
74,181,236,1,A,"Richard Dawson is so British, he has a picture of Her Majesty Queen Elizabeth tattooed on his blank.",233,chest,chest,yes,chest,yes,chest,yes,fannie flagg,no,chest,yes,wife,no,,,
74,182,236,2,B,"At the party, Shirley said to her husband, ""If you're not drunk, then how come you're standing there talking to a blank?""",236,lamp,tree,no,wall,no,wall,no,lamp,yes,lamp,yes,,,,,
74,182,237,1,B,"As Tonto put his ear to the ground and listened for hoofbeats, the Lone Ranger's horse blanked on his head.",237,stepped,sat,no,stomped,yes,made do do,no,sat,no,stepped,yes,stepped,yes,,,
74,182,237,1,A,"When Frank found out his wife was coming to his office, he quickly hid his new secretary in the file cabinet. He filed her under V for blank.",233,voluptuous,virgin,no,very cute,no,virgin,no,vice,no,virgin,no,victory,no,,,
74,182,237,2,B,"Greg said, ""While I was in Africa, a pygmy bit me on the blank.""",237,knee,knee,yes,,,knee,yes,knee,yes,,,,,,,
74,182,237,2,A,"After working together for 15 years, the organ grinder began to blank like his monkey.",233,jump,look,no,,,,,,,,,,,,,
74,183,238,1,A,The president was flabbergasted when he saw blank streaking across the White House lawn.,238,pat,martha mitchell,no,pat,yes,supreme court,no,pat,yes,pat,yes,the first lady,yes,,,
74,183,238,1,B,"Not many people know this, but Julia Child got expelled from cooking school for blanking the Galloping Gourmet.",237,cooking,cooking,yes,resting with,no,basting,yes,riding,no,assaulting,no,cooking,yes,,,
74,183,238,2,A,"With all the shortages these days, robbers no longer say, ""Your money or your life."" Now they say, ""Your money or your blank.""",238,wife,gasoline,no,,,gas,no,,,,,,,,,
74,183,238,2,B,"Sir Lancelot ate so much at the royal banquet, he needed blank to get out of his suit of armor.",237,oil,,,help,no,,,jacksaw,no,help,no,,,,,
74,184,239,1,A,"When water started gushing from the leak in the ark, Noah plugged it with the elephant's blank.",239,trunk,trunk,yes,trunk,yes,trunk,yes,trunk,yes,trunk,yes,trunk,yes,,,
74,184,239,1,B,"Norman said, ""My wife is so ugly, I took her to a wife-swapping party, and all I could swap her for was a blank.""",238,monkey,dog,no,hershey bar,no,dog,no,dog,no,dog,no,goat,no,,,
74,184,239,2,B,"When Miss Kitty returned from a vacation with Marshal Dillon, she announced, ""Well, he blanked with his boots on.""",238,made love,died,no,,,,,slept,no,slept,no,swam,no,,,
74,184,240,1,B,"The cabbie said, ""I'll never pick up Euell Gibbons again. Last night, he ate my blank.""",240,cap,meter,no,back seat,no,meter,no,meter,no,cab,no,cab,no,,,
74,185,240,1,A,"Brian said, ""Boy, I was on a wild new airline. During the flight, the first class passengers are allowed to blank the coach passengers.""",239,play around with,sleep with,no,streak with,no,stone,no,streak with,no,mug,no,pickle,no,,,
74,185,240,2,B,"All the little people in the valley were mad at the Jolly Green Giant, so they put a porcupine in his blank.",240,bed,shorts,no,vegetable patch,no,pea pods,no,bed,yes,pants,no,green suit,no,,,
74,185,240,2,A,"Snow White said, ""All right, which one of you seven dwarves has been wearing my blank?""",239,bra,bra,yes,dress,no,bra,yes,,,,,,,,,
74,185,241,1,A,"Arnold was so sleepy when he came to breakfast, he ate his tie and put a blank around his neck.",241,towel,pancake,no,donut,no,bacon strip,no,piece of bacon,no,banana,no,newspaper,no,,,
74,185,241,1,B,The 102-year-old man jumped off Lovers' Leap holding onto his blank.,239,teeth,old lady,no,wife,no,bride,no,socks,no,wheelchair,no,wheelchair,no,,,
74,186,241,2,A,"Olive Oyl said, ""I'm through with Popeye. The last time I saw him, he made me blank.""",241,eat spinach,pregnant,no,eat spinach,yes,eat spinach,yes,throw up,no,pregnant,no,eat spinach,yes,,,
74,186,241,2,B,"Joyce said to Robert, ""No wonder you're so hunched over! You hook your suspenders to your blank.""",239,socks,shoelaces,no,shoes,no,shoes,no,belt,no,,,,,,,
74,186,242,1,A,"Snow White said, ""You have no idea how much noise there is when the seven dwarves all start blanking at the same time.""",242,snoring,snoring,yes,talking,no,snoring,yes,talking,no,talking,no,talking,no,,,
74,186,242,1,B,"Just as Dr. Welby got to the crucial part of the operation, he sneezed, and the patient's blank bounced onto the floor.",241,heart,liver,no,gallbladder,no,stomach,no,stomach,no,appendix,no,heart,yes,,,
74,186,242,2,A,"At the zoo, Phyllis said to her husband, ""Look at that enormous ape over there. It looks just like your blank.""",242,mother,,,mother,yes,,,mother,yes,mum,yes,father,no,,,
74,187,242,2,B,"Ronald was so rich, at dinnertime, he had someone blank for him.",241,eat,eat,yes,eat,yes,burp,no,eat,yes,eat,yes,,,,,
74,187,242,tie1,A,"Just before the Kentucky Derby, the jockey scratched his blank.",242,horse,behind,no,horse,yes,horse,yes,horse,yes,horse,yes,head,no,,,
74,187,242,tie1,B,Have you heard about the Little Miss Muffet diet? All you eat is blank.,241,curds and whey,curds and whey,yes,curds and whey,yes,curds and whey,yes,muffet,no,whey,yes,curds,yes,,,
74,187,243,1,A,"The nurse said, ""That new surgeon must have an unusual technique. Before the operation, I saw him scrubbing his blank.""",243,feet,feet,yes,nose,no,feet,yes,feet,yes,toes,yes,feet,yes,,,
74,187,243,1,B,"The sideshow barker shouted, ""Hurry, hurry, hurry, step right up and see the man who blanks gasoline!""",241,drinks,drinks,yes,smokes,no,makes,no,makes,no,sips,yes,eats,yes,,,
74,188,243,2,A,"Carmelita said, ""I'll never go out with Zorro again. Last night, he slashed a Z on my blank.""",243,bottom,,,rump,yes,,,,,,,,,,,
74,188,243,2,B,"Harriet said to Vincent, ""You should've been a monkey. All you ever want to do is blank.""",241,swing,,,scratch,no,climb,no,swing,yes,,,,,,,
74,188,244,1,B,"The Jolly Green Giant said, ""No more ho-ho-hoing for me. Euell Gibbons ate my blank.""",244,green beans,pea,no,throat,no,veggies,no,corn,no,shorts,no,foot,no,,,
74,188,244,1,A,"The Godfather said, ""I'm tired of all your jokes. The reason I talk this way is because I got a blank.""",243,sore throat,sore throat,yes,cold,no,sore throat,yes,sore throat,yes,cold,no,frog in my throat,no,,,
74,188,244,2,B,"At the convention, Harry knew that his boss would get drunk and try to slide down the banister, so Harry put blank on it.",244,grease,glue,no,paste,no,glue,no,glue,no,glue,no,,,,,
74,189,245,1,B,"Dora said, ""I'm not going to Dr. Fillmore again. He made me take off all my clothes, and all I went to him for was a blank.""",245,sore throat,sore throat,yes,ear ache,no,ear ache,no,headache,no,prescription,no,toothache,no,,,
74,189,245,1,A,"The mad scientist's wife said, ""There's a strange fog in the laboratory. As soon I walked in, my blank started shrinking.""",243,dress,nose,no,body,no,head,no,head,no,panties,no,clothes,yes,,,
74,189,245,2,B,"Maude said to Walter, ""How dare you tell me my voice sounds like the mating call of a blank?""",245,moose,,,cockatoo,no,moose,yes,crow,no,frog,no,moose,yes,,,
74,189,245,2,A,"Raquel said to the gas station attendant, ""If you'll give me gas today, I'll give you blank tomorrow.""",243,a kiss,myself,no,me,no,whoopee,no,love,no,,,,,,,
74,190,246,1,A,"Marshal Dillon said, ""Miss Kitty's real name ain't Kitty. We just call her Kitty because she eats blank.""",246,liver,cat food,no,tender vittles,no,fish,no,cat food,no,fish,no,fish,no,,,
74,190,246,1,B,"At Irving the plumber's wedding reception, they had a huge plate of chopped liver sculpted in the shape of a blank.",245,wrench,toilet,no,toilet bowl,no,sink,no,sink,no,toilet,no,wrench,yes,,,
74,190,246,2,A,"The queen lost the royal bottle opener, so she opened the royal soda bottle with her royal blank.",246,mouth,teeth,yes,teeth,yes,crown,no,hand,no,mouth,yes,teeth,yes,,,
74,190,246,2,B,"Marvin's bride is so fat, he needed a blank to carry her over the threshold.",245,wheelbarrow,derrick,no,wheelbarrow,yes,derrick,no,basket,no,wheelbarrow,yes,,,,,
74,190,247,1,A,Frank was dishonorably discharged from the Navy for opening a blank on a submarine.,247,hatch,porthole,no,door,yes,torpedo,no,bomb,no,porthole,no,beer,no,,,
74,191,247,1,B,"There was so much static electricity in Paul's house, when he shuffled his feet across the carpet, sparks flew out of his blank.",246,mouth,heel,no,spine,no,hair,no,shoes,no,nose,no,nose,no,,,
74,191,247,2,A,"The Lone Ranger said, ""I'll never lend my great horse Silver to the Godfather again. He left the saddle bags full of blank.""",247,bullets,hay,no,,,machine guns,no,spaghetti,no,spaghetti,no,spaghetti,no,,,
74,191,247,2,B,"Here's a little prehistoric poem: The caveman said to his wife Lucille, ""Before it gets dark, let's make a blank.""",246,fire,bed,no,baby,no,deal,no,fire,yes,wheel,no,deal,no,,,
74,191,247,tie1,A,"The cowboy said, ""Well, I sold my horse but I'm keeping my spurs. I can always use them on my blank.""",247,wife,cow,no,car,no,mother-in-law,no,boots,no,wife,yes,pie crust,no,,,
74,191,247,tie1,B,"Dumb Dora is so dumb, when she moved to the North Pole, the first thing she installed in her igloo was a blank.",246,icebox,refrigerator,yes,air conditioner,no,air conditioner,no,stove,no,air conditioner,no,icebox,yes,,,
74,192,248,1,B,Euell Gibbons has eaten so much natural food that he has blank growing out of his ears.,248,green beans,wood,no,grape nuts,no,dandelions,no,weeds,no,moss,no,nuts,no,,,
74,192,248,1,A,The whole audience cheered when Richard Dawson blanked Gene Rayburn.,246,kissed,kissed,yes,kissed,yes,kissed,yes,kissed,yes,married,no,kissed,yes,,,
74,192,248,2,A,"The surgeon said, ""Boy, is King Kong big. When we took out his appendix, we had to use a blank.""",248,saw,crane,no,wheelbarrow,no,,,,,,,crane,no,,,
74,192,249,1,B,"In the big gambling casino at the North Pole, the tables smell funny because the Eskimos use blanks as chips.",249,bones,skins,no,fish,no,fish,no,walrus teeth,no,blubber,no,fish,no,,,
74,192,249,1,A,"Here's a scene that takes place in a psychiatrist's office: Doctor, I've decided not to marry the duck. Very good, Miss Levy, very good. But why have you decided not to marry the duck? Well, because when we have children, I don't want them blanking around the house.",246,quacking,ducking,no,quacking,no,quacking,yes,quacking,yes,waddling,no,waddling,no,,,
74,193,249,2,A,"Vicky said, ""I would've gotten a speeding ticket today, but I gave the cop a blank.""",249,smile,kiss,no,kiss and/or hug,no,kiss,no,kiss,no,kiss,no,kiss,no,,,
74,193,250,1,A,"Norman said to Fred, ""That girl at the party must have been a train conductor. All night she kept saying blank.""",250,all aboard,tickets out,no,all aboard,yes,tickets please,no,stop,no,all aboard,yes,all aboard,yes,,,
74,193,250,1,B,Prince Valiant always wears a pageboy hairdo because he's a blank.,246,gay,knight,no,princess,no,fairy,yes,princess valiant,no,pansy,yes,princess,no,,,
74,193,250,2,A,"When the sheik came to the White House, they made him check his blank at the door.",250,camel,gun,no,,,camel,yes,camel,yes,,,,,,,
74,193,250,2,B,"Mrs. Schwartz said to her daughter, ""Never marry a man who blanks like your father.""",246,talks,drinks,no,drinks,no,,,,,,,,,,,
74,194,251,1,B,"Max said, ""That was some wild party. There was a six-foot punch bowl with a blank floating in it.""",251,lady,girl,yes,body,no,go go girl,yes,girl,yes,girl named olive,yes,banana,no,,,
74,194,251,1,A,"Here's a TV Guide listing: Saturday night, CBS, M*A*S*H. Hot Lips loses her blank on the operating table. ",250,virtue,lips,no,innocence,yes,virginity,yes,temper,no,virtue,yes,appendix,no,,,
74,194,251,2,A,"After sitting for two hours in the restaurant, Julian finally got the waiter's attention by blanking on the table.",251,standing,,,vomiting,no,,,,,,,banging,no,,,
74,194,251,2,B,"The royal executioner said, ""I just can't wait til my birthday. My mother is making me a new blank.""",250,mask,hood,yes,,,,,rope,no,,,axe,no,,,
74,194,251,tie1,B,"Fay Wray said, ""Do you know what King Kong did at Christmas? He blanked my Christmas tree.""",251,ate,lit,no,ate,yes,ate,yes,decorated,no,ate,yes,ate,yes,,,
74,194,251,tie1,A,"Harvey said, ""My dog acts just like a person. He even uses the blank.""",250,bathroom,toilet,yes,john,yes,water closet,yes,bathroom,yes,car,no,john,yes,,,
74,195,252,1,B,"Colonel Sanders' new car is powered by live chickens. The only problem is, whenever he makes a quick stop, it blanks.",252,lays an egg,squats,no,clucks,no,lays a dozen eggs,yes,fouls,no,lays an egg,yes,cackles,no,,,
74,195,252,1,A,"Mrs. Olson said, ""Cathy, take it from me, your coffee tastes funny because you wash your blank in the coffee pot.""",250,lingerie,filter,no,baby,no,bra,no,stockings,no,socks,no,panties,yes,,,
74,195,252,2,A,Did you hear what happened to Tom while he was sleeping on the beach? A giant crab took his blank away.,252,swimming trunks,blanket,no,lunch,no,,,bathing suit,yes,,,towel,no,,,
74,195,252,2,B,"Long John Silver said, ""Aye, that new pirate is a strange one. Last night, I caught him kissing my blank.""",250,wooden leg,dog,no,first mate,no,first mate,no,first mate,no,,,,,,,
74,196,253,1,A,"While the Jolly Green Giant was walking along the highway, he got really hungry and ate a Mazda. Now every time he blanks, he goes hmmmm.",253,burps,ho-ho-hos,no,toots,no,swears,no,burps,yes,walks,no,belches,yes,,,
74,196,253,1,B,"The holdup man was so nervous, instead of pulling his gun out of his pocket, he pulled out his blank.",252,wallet,finger,no,whistle,no,comb,no,wallet,yes,comb,no,key,no,,,
74,196,253,2,A,"Sam was stranded in the burning desert so long, he tried to blank a mirage.",253,drink,drink,yes,marry,no,kiss,no,,,drink,yes,,,,,
74,196,253,2,B,"Sally the Girl Scout said, ""Nobody was buying my cookies, so I decided to sell my blank.""",252,self,uniform,no,body,yes,bod,yes,,,uniform,no,badges,no,,,
74,196,254,1,A,"The cannibal said, ""I like girls with blank on them.""",254,hair,meat,no,meat,no,meat,no,flesh,no,meat,no,fat,no,,,
74,197,254,1,B,"After Harry's wife threw herself under a moving steamroller, Harry blanked her up.",253,picked,pumped,no,puffed,no,pumped,no,scraped,no,rolled,no,rolled,no,,,
74,197,254,2,A,"Rocco said, ""This neighborhood is so tough that when I walk down the street, I keep both hands on my blank.""",254,gun,wallet,no,hips,no,gun,yes,wallet,no,gun,yes,mother,no,,,
74,197,254,2,B,"Jack Benny said, ""Well, every time I just look at my very expensive Stradivarius violin, I want to blank it.""",253,kiss,play,no,kiss,yes,play,no,play,no,kiss,yes,kiss,yes,,,
74,197,255,1,A,It is a little-known fact of history that Euell Gibbons ate George Washington's blank.,255,hickory nut,cherry tree,no,wife,no,ponytail,no,cookies,no,teeth,no,false teeth,no,,,
74,197,255,1,B,"The rumor is all over the kingdom. At night, Sir Lancelot often blanks in his suit of armor.",253,sleeps,sleeps,yes,sleepwalks,no,sleepwalks,no,sleeps,yes,sleeps,yes,sleeps,yes,,,
74,198,255,2,A,"The scuba diver said to the psychiatrist, ""You may think I'm crazy, but I've fallen in love with a blank.""",255,fish,fish,yes,mermaid,no,mermaid,no,mermaid,no,fish,yes,fish,yes,,,
74,198,256,1,A,"The Jolly Green Giant is so big, he uses the Statue of Liberty as a blank.",256,girlfriend,hat rack,no,girlfriend,yes,night light,no,toothpick,no,night light,no,toothpick,no,,,
74,198,256,1,B,"Larry got so hungry, he ran his blank through the meat grinder and made a hamburger.",253,hand,tongue,no,arm,no,tie,no,fist,yes,hand,yes,dog,no,,,
74,198,256,2,A,"When the Godfather goes skin diving, he doesn't fill his scuba tanks with air. He fills them with blank.",256,money,cement,no,,,sangue,no,wine,no,spaghetti sauce,no,spaghetti,no,,,
74,199,257,1,A,"The Martian said to the Galloping Gourmet, ""This is the most beautiful woman I ever saw,"" and the Galloping Gourmet said, ""That's no woman, that's my blank!""",257,wife,dessert,no,mousse,no,pot,no,souffle,no,jello mold,no,stuffed turkey,no,,,
74,199,257,1,B,"As soon as you walk into Pete's living room, you know he's an airline pilot because he has blanks on his couch.",253,wings,stewardesses,no,caps,no,wings,yes,stewardesses,no,stewardesses,no,stewardesses,no,,,
74,199,257,2,A,"At the South Pole, it is against the law for a man to blank a penguin.",257,date,rub noses,no,marry,no,kiss,no,shoot,no,love,no,eat,no,,,
74,199,258,1,B,"As they led Frankie to the electric chair, the warden asked him for his last request, and Frankie said, ""Warden, could you hold my blank?""",258,hand,hand,yes,hand,yes,hand,yes,hand,yes,hand,yes,hand,yes,,,
74,199,258,1,A,The surgeon trimmed his front hedge to look like a giant blank.,253,stethoscope,heart,no,scalpel,no,scalpel,no,operating table,no,tonsil,no,kidney,no,,,
74,200,258,2,A,"At the party, Dumb Dora ran out of dishes, so she served the party dip in her blank.",253,bra,ashtrays,no,dishpan,no,bra,yes,bra,yes,bra,yes,bra,yes,,,
74,200,259,1,B,"Waldo is a human compass. Wherever he is, his blank points north.",259,nose,nose,yes,body,no,nose,yes,nose,yes,nose,yes,nose,yes,,,
74,200,259,1,A,"Special Agent Maxwell Smart said, ""James Bond fought great criminals like Goldfinger. Me? I have to fight freaks like Blankfinger.""",258,lead,brass,no,index,no,tin,no,no,no,silly putty,no,tin,no,,,
74,200,259,2,B,"Gungarama lost his dog, so he trained his elephant to blank.",259,bark,,,heel,no,,,,,,,,,,,
74,200,259,2,A,"Last Christmas, Santa Claus got so drunk, he tried to stuff his blank into the sack.",258,wife,reindeer,no,beard,no,,,,,,,,,,,
74,201,260,1,B,"The 97-year-old man said, ""Whenever I go streaking, I always take my blank.""",260,cane,wife,no,wife,no,hot water bottle,no,geritol,no,wheelchair,no,nurse,no,,,
74,201,260,1,A,"To keep people from bumping into it in the dark, Ralph hung a red light on his blank.",259,bed,bicycle,no,nose,no,nose,no,nose,no,bike,no,foot,no,,,
74,201,260,2,B,"Elkie said, ""I was engaged to a midget, but we broke up because we had trouble blanking.""",260,kissing,seeing eye to eye,no,eating,no,dancing,no,dancing,no,seeing eye to eye,no,seeing eye to eye,no,,,
74,201,260,2,A,"When the Lone Ranger discovered he was allergic to horses, he got rid of Silver and rode through the West on a blank.",259,bicycle,tonto,no,jackass,no,mazda,no,747,no,cow,no,broom,no,,,
74,201,260,tie1,B,Harry's job requires him to put holes in things. He works in a blank factory.,260,cabinet,swiss cheese,no,door,no,donut,no,swiss cheese,no,cheese,no,bowling ball,no,,,
74,201,260,tie1,A,"At the close of the opera, the soprano hit a really high note, and her contact lenses blanked.",259,broke,broke,yes,,,,,,,,,,,,,
74,202,261,1,B,"One flea said to the other flea, ""My wife Gladys is a real social climber. She wants us to move from a dog to a blank.""",261,cat,siamese cat,yes,person,no,horse,no,person,no,human,no,horse,no,,,
